{
  "$schema": "http://json-schema.org/draft-07/schema#",
  "$id": "https://github.com/Altairpaca/tmc-toolkit/schema/meeting.schema.json",
  "title": "TMC Meeting",
  "description": "头马例会单一事实源 meeting.json 契约（draft-07）",
  "type": "object",
  "additionalProperties": false,
  "required": ["meeting_id", "meeting_number", "date", "meta"],
  "properties": {
    "meeting_id": {
      "type": "string",
      "pattern": "^\\d{4}-\\d{2}-\\d{2}_第\\d+次$",
      "description": "会议唯一标识，如 2026-09-15_第333次"
    },
    "meeting_number": { "type": "integer", "minimum": 1 },
    "date": { "type": "string", "format": "date" },
    "start_time": { "type": "string", "pattern": "^\\d{2}:\\d{2}$", "description": "如 19:15" },
    "end_time": { "type": "string", "pattern": "^\\d{2}:\\d{2}$", "description": "如 21:30", "default": "21:30" },
    "language": { "type": "string", "enum": ["zh", "en", "bilingual"], "default": "bilingual" },
    "theme": {
      "type": "object",
      "additionalProperties": false,
      "properties": { "zh": { "type": "string" }, "en": { "type": "string" } }
    },
    "word_of_the_day": {
      "type": "object",
      "additionalProperties": false,
      "properties": {
        "zh": { "type": "string" },
        "en": { "type": "string" },
        "pos": { "type": "string", "description": "词性" },
        "example": { "type": "string" }
      }
    },
    "venue": { "type": "string", "default": "广州南沙" },
    "roles": {
      "type": "array",
      "items": {
        "type": "object",
        "additionalProperties": false,
        "required": ["role"],
        "properties": {
          "role": { "$ref": "#/definitions/roleEnum" },
          "member_id": { "type": ["string", "null"] },
          "name_zh": { "type": ["string", "null"] },
          "name_en": { "type": ["string", "null"] },
          "note": { "type": "string" }
        }
      }
    },
    "agenda": {
      "type": "array",
      "items": {
        "type": "object",
        "additionalProperties": false,
        "required": ["segment_id", "type"],
        "properties": {
          "segment_id": { "type": "string" },
          "type": {
            "type": "string",
            "enum": ["opening", "facilitator", "table_topics", "prepared_speech",
                     "evaluation", "workshop", "report", "voting", "closing"]
          },
          "title_zh": { "type": "string" },
          "title_en": { "type": "string" },
          "presenter": { "type": "string" },
          "duration_min": { "type": "number", "minimum": 0 },
          "project": { "type": ["string", "null"] },
          "buffer_min": { "type": "number", "minimum": 0, "description": "大环节缓冲（1~3）" }
        }
      }
    },
    "speeches": {
      "type": "array",
      "items": {
        "type": "object",
        "additionalProperties": false,
        "required": ["member_id"],
        "properties": {
          "member_id": { "type": "string" },
          "project_level": { "type": "string", "description": "L1..L5" },
          "project_title": { "type": "string" },
          "pathway": { "type": "string" },
          "evaluator": { "type": ["string", "null"] },
          "requirements": {
            "type": "object",
            "additionalProperties": false,
            "properties": { "min_min": { "type": "number" }, "max_min": { "type": "number" } }
          }
        }
      }
    },
    "guests": {
      "type": "array",
      "items": {
        "type": "object",
        "additionalProperties": false,
        "required": ["name"],
        "properties": {
          "name": { "type": "string" },
          "contact": { "type": "string" },
          "source": { "type": "string" },
          "is_new": { "type": "boolean", "default": true }
        }
      }
    },
    "rsvp": {
      "type": "array",
      "items": {
        "type": "object",
        "additionalProperties": false,
        "required": ["name"],
        "properties": {
          "name": { "type": "string" },
          "role_pref": { "type": "string" },
          "confirmed": { "type": "boolean", "default": false }
        }
      }
    },
    "ballot": {
      "type": "array",
      "items": {
        "type": "object",
        "additionalProperties": false,
        "required": ["category"],
        "properties": {
          "category": {
            "type": "string",
            "enum": ["best_speaker", "best_evaluator", "best_table_topics", "best_role"]
          },
          "candidates": { "type": "array", "items": { "type": "string" } },
          "result": { "type": "array", "items": { "type": "string" } }
        }
      }
    },
    "officers_records": {
      "type": "object",
      "additionalProperties": false,
      "properties": {
        "timer": {
          "type": "array",
          "items": {
            "type": "object",
            "additionalProperties": false,
            "required": ["segment_id"],
            "properties": {
              "segment_id": { "type": "string" },
              "planned_min": { "type": "number" },
              "actual_sec": { "type": "number" },
              "status": { "type": "string", "enum": ["green", "yellow", "red"] }
            }
          }
        },
        "ah_counter": {
          "type": "array",
          "items": {
            "type": "object",
            "additionalProperties": false,
            "required": ["member_id"],
            "properties": {
              "member_id": { "type": "string" },
              "counts": { "type": "object", "additionalProperties": { "type": "integer", "minimum": 0 } },
              "top3": { "type": "array", "items": { "type": "string" } }
            }
          }
        },
        "grammarian": {
          "type": "array",
          "items": {
            "type": "object",
            "additionalProperties": false,
            "required": ["member_id"],
            "properties": {
              "member_id": { "type": "string" },
              "good_phrases": { "type": "array", "items": { "type": "string" } },
              "corrections": { "type": "array", "items": { "type": "string" } }
            }
          }
        }
      }
    },
    "minutes": { "type": "string", "description": "会后纪要（Markdown）" },
    "attachments": {
      "type": "array",
      "items": {
        "type": "object",
        "additionalProperties": false,
        "required": ["name"],
        "properties": { "name": { "type": "string" }, "path": { "type": "string" } }
      }
    },
    "meta": {
      "type": "object",
      "additionalProperties": false,
      "required": ["version", "owner", "updated_at"],
      "properties": {
        "version": { "type": "string", "default": "1.0" },
        "owner": { "type": "string", "default": "Altair Li" },
        "updated_at": { "type": "string", "format": "date-time" }
      }
    }
  },
  "definitions": {
    "roleEnum": {
      "type": "string",
      "enum": [
        "meeting_manager", "opening", "toastmaster_of_ceremony", "general_evaluator",
        "timer", "ah_counter", "grammarian", "facilitator", "photographer",
        "speaker", "evaluator", "table_topics_master", "table_topics_evaluator",
        "workshop_speaker", "ballot_officer", "receptionist", "slides_operator",
        "computer_support", "president", "next_meeting_manager"
      ]
    }
  }
}
