{
  "meeting_id": "2026-09-15_第333次",
  "meeting_number": 333,
  "date": "2026-09-15",
  "start_time": "19:15",
  "end_time": "21:30",
  "language": "bilingual",
  "theme": { "zh": "重构", "en": "Refactor" },
  "word_of_the_day": { "zh": "韧性", "en": "resilience", "pos": "n.", "example": "She showed great resilience under pressure." },
  "venue": "广州南沙",
  "roles": [
    { "role": "toastmaster_of_ceremony", "name_zh": "张三", "name_en": "Zhang San" },
    { "role": "timer", "name_zh": "李四", "name_en": "Li Si" }
  ],
  "agenda": [
    { "segment_id": "seg-opening", "type": "opening", "title_zh": "会议召集", "duration_min": 1 }
  ],
  "speeches": [],
  "guests": [],
  "rsvp": [],
  "ballot": [],
  "officers_records": { "timer": [], "ah_counter": [], "grammarian": [] },
  "minutes": "",
  "attachments": [],
  "meta": { "version": "1.0", "owner": "Altair Li", "updated_at": "2026-09-15T12:00:00Z" }
}
